"name";"answer";"questions";"rcounts"
"4. Техническая поддержка (support@pnu.edu.ru)";Для входа https://pk.pnu.edu.ru/ используются учетные данные личного кабинета абитуриента  если вы не можете зайти на https://pk.pnu.edu.ru/ смените пароль http://pnu.edu.ru/ru/applicant/cabinet/reconfirm/  Попробуйте зайти на https://pk.pnu.edu.ru/  с новым паролем ;   Скриншот проблемы прилагаю. Почта: hikita-_-28.2000@mail.ru. Чуриков Никита Сергеевич. Экзамен дистанционный. Время 8:56.  --  Никита Сергеевич  Отправлено из Почты  Mail.ru=====Здравствуйте , я не могу зайти на портал ТОГУ ,ввожу свою почту и пароль который мне прислали,там ошибка,либо пароль не верный ,либо почта         --  Алина Никифорова  Отправлено из Почты  Mail.ru=====Здравствуйте, не могу зайти по ссылке, чтобы пройти тест на магистратуру.  Пишет , что неверный логин или пароль=====Здравствуйте, при входе на сайт возникает ошибка -не могу зайти, пишет, что введен неверный пароль ;18
"4. Техническая поддержка (support@pnu.edu.ru)";Для получения кода для первого входа в portal.khstu.ru, вам нужно обратиться к Долгачеву Михаилу Владимировичу 409ц;Прошу назначить логин и пароль для входа в личный кабинет сотруднику кафедры вычислительной техники: Гадоев Сабзаали Мухшулович (006884@pnu.edu.ru)  С уважением,  зав. кафедрой ВТ  С.В. Сай      IP-адресс: 10.10.100.114=====Здравствуйте!  в соответствии с приказом от 06.10.2021 г. № 036/635 к. в  Управление международной деятельности принят новый сотрудник Будлянская  Татьяна Ивановна. Прошу Вас выдать логин/пароль от Портала ТОГУ и Lotus      С* уважением, Будлянская Наталья Ивановна*  *специалист отдела международного сотрудничества*  *Управление международной деятельности*    *Тихоокеан;2
"4. Техническая поддержка (support@pnu.edu.ru)";Для регистрации в личном кабинете, вам необходимо получить код регистрации.  Студентам университета код выдается в деканате своего факультета.  https://portal.pnu.edu.ru/accounts/register/;Здравствуйте, я студент 1-го курса заочной формы обучения группы «Строительства» Приходько Дмитрий Олегович на сегодняшний день у меня отсутствует корпоративная почта, логин и пароль электронного личного кабинета. В связи с этим прошу выслать на данный электронный адрес данные для доступа к личному кабинету и корпоративной почте.       --  Дмитрий Олегович=====Добрый день. Являюсь студентом Вашего университета, Теплякова Наталия Андреевна, приказ о зачислении № 120/1278 от 25.10.2021 г.  Прошу уточнить, каким образом я могу войти в личный кабинет, у меня н;2
"4. Техническая поддержка (support@pnu.edu.ru)";Для регистрации в личном кабинете, вам необходимо получить код регистрации.  Студентам университета код выдается в деканате своего факультета.;Добрый день, не могу зайти в личный кабинет студента, не могли бы Вы  прислать мне актуальные для входа данные?    <https://www.avast.com/sig-email?utm_medium=email&utm_source=link&utm_campaign=sig-email&utm_content=webmail>  Без  вирусов. www.avast.ru  <https://www.avast.com/sig-email?utm_medium=email&utm_source=link&utm_campaign=sig-email&utm_content=webmail>  <#DAB4FAD8-2DD7-40BB-A1B8-4E2AA1F9FDF2>=====Здравствуйте, скажите пожалуйста, как мне получить код для входа в личный  кабинет студента? Обучаюсь дистанционно=====вт, 9 нояб. 2021 г., 13:35 <support@pnu.edu.ru>:    > Здравствуйте! Не забудьте прочесть письмо до конца!  >  > Настоящим мы подтверждаем, что получили Ваше сообщение.  > Мы обработаем Ваш ;6
"4. Техническая поддержка (support@pnu.edu.ru)";Документы подписаны ЭЦП и размещены;"08.03.01 -АД-2020-РПД, ФОС для автомоб. дорог.rar  <https://drive.google.com/file/d/16SATn70xwlaU29oWNdhjzTfmIdovgBou/view?usp=drive_web>    08.03.01 ГИА АД (3++) (4).pdf  <https://drive.google.com/file/d/1o5XkwB_R7qcgeoHpVMyZvJ9vSHbEgmYp/view?usp=drive_web>    08.03.01 ОХОП АД (3++) (2).pdf  <https://drive.google.com/file/d/1DmIgQkkCkuWXuqEeJUkOP6A5AQolZl1u/view?usp=drive_web>    08.03.01 ПП АД (3++) (2).pdf  <https://drive.google.com/file/d/12KAt1OvsdkXH86EsE6UWnfy5ybP7qWyb/view?usp=drive_web>    27.04.04_УТС_2022_Аннотации.pdf  <https://drive.google.com/file/d/1OzmVpSlqchgcu9PYJ4boICSzRh1E4DZq/view?usp=drive_web>    29.03.04 Аннот. раб. пр. О ТХОМ ++ 19.pdf  <https://drive.google.com/file/d/1x63undOqyRdH1Qq_LhoYWTcUf_4vMy7v/view?usp=drive_web>    40.03.01_Ю_ГП_2019_Аннотации.pdf  <https://drive.google.com/file/d/1s6a0npz5o8k52z_ve8-uRDEkkv7mGCrM/view?usp=drive_web>    40.03.01_Ю_ГрП_2019_Аннотации.pdf  <https://drive.";3
"4. Техническая поддержка (support@pnu.edu.ru)";Доступ в личный кабинет останется с ограниченым функционалом, пропуск будет заблокирован  Система автоматизирована, технической возможности не предусмотренно для исключений.  ;Здравствуйте!  Меня по приказу увольняют 31.08.2022.  Но с 01.09.2022 вновь принимают на должность делопроизводителя кафедры ЭАТ.  Прошу сохранить доступ в ТОГУ по электронному пропуску и в портал https://portal.pnu.edu.ru/ по существующему логину      IP-адрес: 10.10.100.114=====Здравствуйте!  Меня по приказу увольняют 31.08.2022.  Но с 01.09.2022 вновь принимают на ту же должность (доцент кафедры ЭАТ).  Прошу сохранить доступ в ТОГУ по электронному пропуску и в портал https://portal.pnu.edu.ru/ по существующему логину      IP-адрес: 10.10.100.114;2
"4. Техническая поддержка (support@pnu.edu.ru)";Доступ предоставлен, проверьте личный кабинет;"Как получить доступ к портфолио студентов-выпускников для их рецензирования и оценивания?      IP-адресс: 164.138.93.100=====Добрый день.  Прошу дать Евгению Шишкину номер дела 004655 права  ответственного по НИР на кафедре ТТС    --   С уважением,  Ким Дин Су (Ким Денис),  аналитик Департамента научных исследований ФГБОУ ВО ""ТОГУ""  012457@pnu.edu.ru";2
"4. Техническая поддержка (support@pnu.edu.ru)";"Если Вам не пришло сообщение для подтверждения учетной записи или Вы не можете войти в ""Личный кабинет абитуриента"", воспользуйтесь формой восстановления пароля http://pnu.edu.ru/ru/applicant/cabinet/reconfirm/     Обращаем Ваше ВНИМАНИЕ!!!   Анкета требует уникальности введенного номера телефона и Email адреса. В случае повторного возникновения ошибки пришлите скриншот в службу технической поддержки (support@pnu.edu.ru)";--  Юген Ли  Отправлено из Почты  Mail.ru    Здравствуйте, я хотела зарегистрироваться в личном кабирете абитуриента, пришла ссылка, но пишет, что код не активен=====89143706520 Бабичева Юлия Сергеевна   --  Отправлено из Mail.ru для Android=====Добрый день! Мне отправили ссылку на регистрацию для подтверждения учётной записи, но по ней пройти не могу, она не активна. Активация не удалась!  Какие мои дальнейшие действия? Мне необходимо подтверждение для подачи документов при поступлении…        Отправлено из мобильной Почты Mail.ru=====Добрый день!   Зарегистрировалась в личном кабинет;41
"4. Техническая поддержка (support@pnu.edu.ru)";Если при входе в личный кабинет выходит сообщение: Неверный пароль или имя пользователя, то вам необходимо указать верные данные или заново пройти процедуру регистрации, перейдите по данной ссылке, там подробно описан механизм получения кода для регистрации. https://portal.khstu.ru/accounts/register/ Если проблема другого характера то пожалуйста полностью опишите проблему, желательно еще предоставить print screen, тогда ваша проблема будет решена намного быстрее.;   Здравствуйте, мне не приходит пароль от личного кабинета я много раз пыталась уже   мне нужно посмотреть баллы, как мне в него войти ?  --  Галина Карпова  Отправлено из Почты  Mail.ru=====Здравствуйте , могли бы вы удалить мой аккаунт в тогу в личном кабинете , на сайте . Не могу зайти в свой кабинет . Создать новый тоже не могу       Отправлено из мобильной Почты Mail.ru=====Здравствуйте!  Не могу вспомнить пароль,мне письмо не приходит с инструкцией,чтобы  изменить его.=====студент Лощинин Валентин Владимирович, ЗФ, группа ЗЧС(аб)з-71.  Ранее регистрировался на портале, но ;13
"4. Техническая поддержка (support@pnu.edu.ru)";Задача давно решена. Забыл закрыть.;Здравствуйте    магистрант заочник не может зарегистрироваться в личном кабинете студента.  Прошу техподдержки: пересылаю его обращение    С уважением, замдиректора ИЭУ Кулик И.В.      ---------- Forwarded message ---------  От: Владимир Дударко <livestar88@mail.ru>  Date: чт, 5 нояб. 2020 г. в 15:17  Subject: Re: Регистрационные данные  To: Иван Кулик <kulivan@pnu.edu.ru>      Здравствуйте! при регистрации выдает следующее:    Учетная запись находится в архиве по причине увольнения или отчисления из  университета. Сотрудникам необходимо обратиться в отдел кадров для  уточнения информации. Студентам обращаться в ;2
"4. Техническая поддержка (support@pnu.edu.ru)";Задача давным давно решена. Забыл закрыть.;Здравствуйте.    Прошу рассмотреть заявление студентки и оказать техподдержку.    С уважением, Кулик И.В.    ---------- Forwarded message ---------  От: Александр Зубарев <000008@pnu.edu.ru>  Date: чт, 12 нояб. 2020 г. в 08:29  Subject: Fwd:  To: <kulivan@pnu.edu.ru>          Отправлено с iPhone    Начало переадресованного сообщения:    *От:* Александра Дзюба <2018103652@pnu.edu.ru>  *Дата:* 11 ноября 2020 г., 20:50:35 GMT+10  *Кому:* Александр Зубарев <AZubarev@pnu.edu.ru>    Добрый день! Я, Дзюба Александра Сергеевна, студентка группы Фк(аб)з-91,  заочная форма обучения. Ранее обучалась в группе Фк(аб)оз-81 Очно-заочная  форма обуч. Была переведена на заочную форм;2
"4. Техническая поддержка (support@pnu.edu.ru)";заполните повторно, нажмите правой кнопкой мыши - Сохранить страницу как  Затем отправьте сохраненный файл;"Повторно сообщаю, что не происходит отправка данных, после нажатия кнопки ""отправить""      IP-адрес: 37.29.88.37=====Ответ пришел из поддержки проверить. Проверила - не работает.      IP-адрес: 185.3.181.177";2
"4. Техническая поддержка (support@pnu.edu.ru)";Здравствуйте вам необходимо сменить пароль от личного кабинета  https://portal.khstu.ru/accounts/password_change/;Здравствуйте. Я студен ТОГУ группы МБ(пб-91)з Немцев Евгений Сергеевич.. У  меня проблема не могу зайти на корпоративную почту. Помогите разобраться. В  учебной части говорят что я не зарегистрирован на почте. При в Ворде логина  почта пишет что логин не найден.=====Прошу восстановить доступ к корпоративной почте ТОГУ (2020100676@pnu.edu.ru  - адрес корпоративной почты)=====Тюрина Евгения ЗМУ(аб)з-01 не могу зайти на почту   2020101518@pnu.edu.ru  пишет что удалено  --  Тюрина Е.В.=====Прикладываю скриншоты. нажимаю на почта получаю неправильный адрес.  [image: Новый точечный рисунок.bmp][image: п;77
"4. Техническая поддержка (support@pnu.edu.ru)";Здравствуйте вам необходимо сменить пароль от личного кабинета  https://portal.pnu.edu.ru/accounts/password_change/;Здравствуйте, не работает корпоративная почта, появляется сообщение об ошибке (скриншот прикреплен).       IP-адресс: 188.162.228.231=====Здравствуйте,я не могу войти на портальную почту.  Не могли бы вы решить эту проблему?      IP-адресс: 80.83.234.87===== Не могу зайти в раздел почта на портале      IP-адресс: 85.15.118.98;3
"4. Техническая поддержка (support@pnu.edu.ru)";Здравствуйте необходимо сменить пароль от личного кабинета  https://portal.khstu.ru/accounts/password_change/;Здравствуйте я Лютина Екатерина староста группы УгП(аб)з-61, у моей  студентки Василец Виктории нет возможности зайти на почту, она не работает  и выходит вот такое сообщения=====Студент Аблаев Демид (ОНГабз-01) не может зайти на занятие через ссылку гугл. Ему пишут, что пропала его учетная запись. А раньше было всё нормально. В личный кабинет он входит.       IP-адресс: 95.70.44.137=====Добрый день.  У студента гр. ГП(аб)з-61 не работает почтовый ящик, выдает ошибку, когда наживаешь почту.  Студент писал в службу поддержки, но пока не ответили ему. Клёвов А. Н.  Скоро госэкзамен в;3
"4. Техническая поддержка (support@pnu.edu.ru)";изменения внесены, проверьте через 30 минут;Здравствуйте.  В разделе Трудоустройства https://portal.pnu.edu.ru/recruitments/recruitment_management/ (анкеты выпускников), в подразделе задачи (выгрузка в эксель) произошел сбой. Когда идет выгрузка в эксель, то группа КБ(с)-61 отсутствует и группа ГД(с)-61 есть, но данные отсутствуют. Хотя на сайте информация есть. Устраните, пожалуйста, проблему.      IP-адресс: 10.10.100.114=====Здравствуйте.  В разделе анкеты выпускников https://portal.pnu.edu.ru/recruitments/recruitment_management/#,  при выгрузке Excel файла отсутствует группа КБ(с)61 (всего один человек, их больше - 9). Укажите, пожалуйста, на ошибку.      IP-адресс: 10.10.100.114=====На се;4
"4. Техническая поддержка (support@pnu.edu.ru)";Исправления внесены.;"https://pnu.edu.ru/ru/faculties/additional/fppk/programs/  .здравствуйте,можно на странице удалить цифру ""3"" внизу.Спасибо.    также на странице https://pnu.edu.ru/ru/faculties/additional/ исправить  электронную почту во так:    За дополнительной информацией обращаться в Департамент дополнительного  образования по телефону: 8(4212)75-78-48 – кампус на ул. Тихоокеанской, 136.  *e-mail: *fppk@pnu.edu.ru    и на этой же странице добавить где *Профессиональное обучение*  <https://pnu.edu.ru/ru/faculties/additional/fppk/programs/vocational-training/>  :    *Профессиональное обучение*    Ø Автомобильная отрасль    Ø Педагогическая деятельность    Ø  Экологическая безопас";27
"4. Техническая поддержка (support@pnu.edu.ru)";"логин:2022100675  пароль:Cdhcsk27_;  почта гугл работает";Я не могу пройти туда у нас первый семестр осенний проходит цистанционно        Доброго дня.  ---  С уважением  Толмачёв Валерий Владимирович.         >Среда, 18 января 2023, 12:25 +10:00 от support@pnu.edu.ru:  >   >Здравствуйте!  >пройдите в 119 цв Тогу главный корпус  >----------------------------------------------------------------------  >С уважением, группа технической поддержки ТОГУ  >support@pnu.edu.ru   =====      Доброго дня.     Нет возможности работь с электронной почтой Скрин 1.     Пытаюсь перейти. Выходит ошибка крин 2.     Фото в закрепе     С уважением  Толмачёв Валерий Владимирович.;2
"4. Техническая поддержка (support@pnu.edu.ru)";Можете удолять из расписания, кнопка появилась.;"Здравствуйте! ФФПиМК:  группа ФР(б)-11 во вторник удалить пару  группа не набралась.  ФЛ(б)-11 среда 2 пара лишняя  ФЕНМиИТ группа ПОМИ(б)-01 пятница 1 пара числитель лишняя пара    --   С Уважением,  специалист по УМР Елена Валентиновна Цой  раб т. (4212) 42-06-99=====При составлении расписания группа ПОБХ(б)-01 была разбита на подгруппы. Затем из-за снижения контингента разбивку на подгруппы в АИС ""Нагрузка Вуза"" убрали. В расписании были внесены изменения, но убрать полностью занятия, которые ушли не получается. Уберите пустые строки в расписании ПОБХ(б)-01        IP-адресс: 10.0.12.54";2
"4. Техническая поддержка (support@pnu.edu.ru)";напишите на электронный адрес  fdpo-po@pnu.edu.ru;"--   Отправлено из мобильного приложения Яндекс.Почты=====Добрый день, имеется ли возможность отправить удостоверения о прохождении  курсов (противодействие коррупции; управление образовательной организацией)  не по месту жительства, а сразу на адрес университета?    --   С уважением, Шитов Андрей Константинович  Старший преподаватель кафедры права и методики его преподавания ФГБОУ ВО УрГПУ,  заместитель директора Института общественных наук ФГБОУ ВО УрГПУ  тел: 8  (343) 336-14-55";2
"4. Техническая поддержка (support@pnu.edu.ru)";Не беспокойтесь, происходит обновление базы;Добрый день!  Подскажите пожалуйста, у меня личный кабинет был заблокирован.    Его можно как-нибудь разблокировать?    Заранее благодарю=====Здравствуйте, производила оплату за обучение 14 августа за 7 семестр  студентка Абричкина Анна Андреевна ПОНБ (с)-01., заходя в свой личный  кабинет пишет что отчислена по причине не уплаты, все скрины прилагаю.=====Я, Гаевая Татьяна Евгеньевна, студентка группы ПОНБ(с)-21, сегодня  обнаружила, что моя учетная запись на портале ТОГУ находится в архиве по  причине отчисления=====Ваша учётная запись находится в архиве по причине от;19
