"name";"answer";"questions";"rcounts"
"4. Техническая поддержка (support@pnu.edu.ru)";Попробуйте завтра зайти в личный кабинет;Здравствуйте, я студент 1 курса Богданов Роман. Прошу разобраться с проблемой входа.   --  С любовью и теплотой,  Bogdanov Roman  +79147796607     =====Я не могу зайти в свой кабинет студента. Написано что меня отчислили, но в  приказе на зачисление (заочное обучение) я есть.;2
"4. Техническая поддержка (support@pnu.edu.ru)";Попробуйте снова записаться на курс;Адрес смог заполнить, но теперь не дает возможности выбрать название курса      -------- Пересылаемое сообщение --------  От кого: Гарипов Ильнур <ilnur_garipov@mail.ru>  Кому: support@pnu.edu.ru  Дата: Пятница, 27 ноября 2020, 17:24 +03:00  Тема: проблемы при регистрации     Добрые время суток!  Хотел пройти регистрацию на обучение в рамках федерального проекта «Новые возможности для каждого».  Письмо Подтверждение почты для записи на курс ТОГУ пришло. Прошел по ссылке. Начинаю заполнять поля. Дохожу до адреса. При сохранении адреса перебрасывает на страницу где требует еще раз указать адрес (н;9
"4. Техническая поддержка (support@pnu.edu.ru)";попробуйте снова записаться на курсы;Добрый день. Извините, но я снова не смогла зарегистрироваться до конца на вашем сайте для прохождения ФПК. Действительно, как и указано в письме я не смогла установить выбранные темы курсов, они не высвечивались. Или их нужно набрать самим руками?  При заходе по ссылке выпадает другой пароль, я его меняла на тот, что мне указан в письме BRnbkKk37#*, но окно с названием курсов не открывалось.  Пробовала заходить и с предложенным новым паролем — ничего. Убедительно прошу помочь решить проблему.   Сообщите, пожалуйста, так я могу приступать к занятиям или нет?       ;2
"4. Техническая поддержка (support@pnu.edu.ru)";попробуйте снова зарегестрировать документ;"Здравствуйте, не так давно стали поступать сообщения на почту ""поступил  документ на регистрацию"". Филимонова О.В. прокомментировала, что  распоряжения за подписью Ковальчук С.А. может зарегистрировать любой  сотрудник ДАП.  Документ создал сотрудник деканата, по содержанию подходит ООСУП, но при  попытке зарегистрировать выходит ошибка Ошибка: undefined (0; 0)  (02.04.2021 11.40)  Поступил документ на регистрацию. Распоряжения за подписью проректора  Ковальчук С.А.: Распоряжение об установлении индивид. графика сессии  студенту гр СДМ(аб)зу-81 Рахманову А.Ю.    [image: image.png]    ";2
"4. Техническая поддержка (support@pnu.edu.ru)";Попробуйте снова зарегистрировать ;Добрый день! В Логике завис приказ с зарезервированным номером  [image: image.png]  034/0103 от 21.04.2023.  После зависания было предложено запустить новый приказ и попытаться  присвоить ему тот же номер, не выходит, система ругается на то. что номер  уже существует.  Прошу удалить данный резерв и присвоить следующему приказу номер удаленного  резерва  [image: image.png]    --     С уважением,    Павликов Алексей Борисович    Начальник ОСАП ФГБОУ ВО «ТОГУ»=====Добрый день! Прошу помочь в решении проблемы. Не выходит зарегистрировать  приказ. Выдает следующую ошибку. Пытался через обычный с;2
"4. Техническая поддержка (support@pnu.edu.ru)";попробуйте снова пройти запись на курс;Здравствуйте, у меня не получается зарегистрироваться на курсы «Иновационная деятельность учителя начальных классов»        С уважением  Екатерина Александровна, заместитель директора по ОТ и ТБ  Ekaterina_khv@mail.ru   =====Здравствуйте, пытаюсь зарегистрироваться на курсы повышения квалификации на ФДО, но не получается. Выходит сообщение, что с моего имейла (причём я пробовала уже 2 разных имейла) уже осуществлялась регистрация. Такая ситуация исключена! Что делать? (имейлы blagmeg@yandex.ru, blagmeg@mail.ru)         --     С уважением,    Мусаева Елена     ;2
"4. Техническая поддержка (support@pnu.edu.ru)";попробуйте создать документ как написано в инструкции  http://help.pnu.edu.ru/index.php/4._%D0%AD%D0%BB%D0%B5%D0%BA%D1%82%D1%80%D0%BE%D0%BD%D0%BD%D0%BE%D0%B5_%D1%81%D0%BE%D0%B3%D0%BB%D0%B0%D1%81%D0%BE%D0%B2%D0%B0%D0%BD%D0%B8%D0%B5_%D0%BF%D1%80%D0%B8%D0%BA%D0%B0%D0%B7%D0%BE%D0%B2_%D0%BF%D0%BE_%D0%BF%D1%80%D0%B0%D0%BA%D1%82%D0%B8%D0%BA%D0%B0%D0%BC  Только выбирайте Приказы о направлении на практику ТОГУ;Добрый день, уже второй день пишу в тех поддержку, никто не отвечает.   Проблема: в логике не создает новый документ. выкидывает обратно на первую страницу. а документ надо создать срочно (приказ на преддипломную практику) и отправить на согласование.       IP-адресс: 95.85.91.196=====Не работает ЛОГИКА, пробую отправить приказ на прохождение практики, после команд: создать приказ - ОРД - приказ на практику  ТОГУ - V - Ok, возвращает на начальную страницу. Соответственно нет возможности отправить приказ который не укладывается в сроки.        IP-адресс: 188.162.228.142;2
"4. Техническая поддержка (support@pnu.edu.ru)";Преподаватель не проставил в учебном плане данные.  Как только преподаватель заполнит данные вы автоматически будете добавлены к курсу;Я вначале связался с преподавателем, говорит сдавайте контрольную на курсе, пытаюсь зайти на курс-не выходит, преподаватель говорит к вам обращаться.     Отправлено с моего телефона Huawei        -------- Исходное сообщение --------  От: support@pnu.edu.ru  Дата: вт, 22 сент. 2020 г., 17:05  Кому: 100701169@pnu.edu.ru  Тема: Ответ: Re: Группа технической поддержки [Обращение (Внеплановое) № 47704] - Прочтите! [Обращение (Внеплановое) #47941]        Здравствуйте!                Напишите учителю курса                    С уважением, группа технической поддержки ТОГУ    support@pnu.edu.ru=====Здравствуйте! У меня отсутствует доступ к курса;2
"4. Техническая поддержка (support@pnu.edu.ru)";пришлите снимок экрана с проблемой;Ув. служба! Пересылаемый документ [СЭД ТОГУ] Ознакомление с документом.  Приказы и распоряжения за подписью ректора №011/6рн/0366 от 09.09.2021: О  проведении инструктажей по вопросам обеспечения комплексной безопасности,  среди работников и учащихся университета  НЕ ОТКРЫВАЕТСЯ. Как обеспечить доступ к нему?  Зав. кафедрой журналистики С.И. Якимова.    ---------- Forwarded message ---------  От: LogicECM <LogicECM@mail.khstu.ru>  Date: чт, 9 сент. 2021 г. в 14:13  Subject: [СЭД ТОГУ] Ознакомление с документом. Приказы и распоряжения за  подписью ректора №011/6рн/0366 от 09.09.2021: О проведении инструктажей по  вопросам обе;2
"4. Техническая поддержка (support@pnu.edu.ru)";Пришлите снисл, мы внесем данные в  информационную систему;*  Неверен код подтверждения электронной почты. Он действует один день. Пройдите подтверждение email в первой форме еще раз...  Добрый вечер! Не могу отправить СНИЛС, выходит эта запись. Посоветуйте что нужно сделать.С уважением Фукалова Н.В,        --  Наталья Васильевна Фукалова=====     Уважаемый слушатель, просьба заполнить СНИЛС. Для этого перейдите по ссылке   http://pnu.edu.ru/ru/faculties/additional/programms_qual_inc/add_data/?email=karyakina_n22@mail.ru&email_confirm_key=d5b05ccc767fcb9ad511ef6e54d899bc2c05a8a6adb456d2069b305cef800c92ef49aeb410489d569021314f9fdaebe6f39d7a3333bea70e2893dbd1b73ae1b0   еще раз и дозаполните анкету.     -- С уважением,  Наталия Карякина=====;44
"4. Техническая поддержка (support@pnu.edu.ru)";пробуйте снова   должно все работать;"Здравствуйте, что случилось с моей учётной записью в электронном учебном  курсе? Может это временные неполадки?=====Здравствуйте, я не могу зайти в ТОГУ ЛК, сайт выдает ответ Авторизация  прошла успешно, но в АИС ТОГУ не существует пользователя с логином  ""2019103291"" ({}).";2
"4. Техническая поддержка (support@pnu.edu.ru)";Проверил. все загрузилось с вечера 31 мая;"Здравствуйте,  проводится проверка загрузки данных на Суперсервис.  Проверка проводится поэтапно по формам обучения.  По очно-заочной и заочной форме обучения в настоящее время выявлены  следующие проблемы:  - Для конкурса 5571 (заочно, 44.03.05 Русский и литература) - не создан  конкурс для целевой квоты, в котором нет заказчика;  - Для конкурса 5575 (заочно, 44.03.05 Физкультура) - неверно созданы  конкурсы для целевой (3+1 места, а нужно 2+1 - это попробую руками  исправить);  - Для конкурса 5565 (заочно 44.03.05 Математика. Инф) - неверно созданы  конкурсы для целевой (4+1 места, а нужн";2
"4. Техническая поддержка (support@pnu.edu.ru)";Рабочие программы дисциплин опубликованы;Добрый день, я являюсь специалистом по учебно-методической работе кафедры государственно-правовых дисциплин Юридического института. Прошу вас прикрепить материалы рабочих программ по дисциплинам нашей кафедры в соответствии с высланной ниже структурой    Девятым письмом высылаю:  дисциплины по выбору вариативной части учебного плана специальности 40.05.01 «Правовое обеспечение национальной безопасности» (специализация № 2. Государственно-правовая)  •	Делопроизводство/Основы документооборота и корреспонденции  •	Противодействие коррупции в системе;10
"4. Техническая поддержка (support@pnu.edu.ru)";Сайт для входа  http://portal.khstu.ru/      Код для регистрации  6CV 73N VFT  Имя пользователя  2016100840  ;Здравствуйте! Я немогу войти в систему электронного обучения , можно каким-либо способом переоформить мне логин и пароль?! С 27.04.20 у меня начинается сессия                    Одаев Егор Александрович, группа СОСП(аб)з-61      IP-адресс: 95.70.43.140=====Я немогу зайти на почту, прошу Вас позвонить по телефону +79098447701, по нему же дать обратную связь      IP-адресс: 77.41.190.241;2
"4. Техническая поддержка (support@pnu.edu.ru)";Смените или пересохраните пароль для входа на портал;Неправильный адрес электронной почты      IP-адресс: 10.27.1.47=====Из личного кабинета не могу попасть в почту тогу   Как привязать почту тогу к почте к Гугл почте ?      IP-адресс: 213.221.12.180=====Не удалось найти аккаунт google (2021103156@pnu.edu.ru)      IP-адресс: 10.27.1.39=====здравствуйте! при попытке зайти в почту внутри личного кабинета высвечивается ошибка, что делать?      IP-адресс: 80.83.234.60=====G Suite - Неправильный адрес электронной почты	  	  Неправильный адрес электронной почты  Нам не удалось обработать ваш запрос в данный момент. Повторите попытку позже.      IP-адресс: 10.27.1.60=====Луенко Александ;16
"4. Техническая поддержка (support@pnu.edu.ru)";смените пароль от личного кабинета и заново зайдите в почту;"не получается войти в корпоративную почту, прошу прислать ответ на другую почту      IP-адрес: 80.83.238.115=====Здравствуйте! Я студент ДПИ (б)-31, Алексеева Екатерина Петровна. При попытке активировать почту 2023101264@pnu.edu.ru произошла ошибка: ""Неправильный адрес электронной почты  Нам не удалось обработать ваш запрос в данный момент. Повторите попытку позже."" Скриншот прикрепляю.       IP-адрес: 10.0.5.58";2
"4. Техническая поддержка (support@pnu.edu.ru)";Смените пароль, можно даже на текущий, и попробуйте снова войти в почту;"2021100669   не создается корпоративная почта       IP-адресс: 10.10.226.27=====Текст ошибки:  G Suite - Неправильный адрес электронной почты 	  Неправильный адрес электронной почты  Нам не удалось обработать ваш запрос в данный момент. Повторите попытку позже.      IP-адресс: 10.10.226.27===== 	G Suite - Неправильный адрес электронной почты 	  	  	Справка|Выйти  Неправильный адрес электронной почты    Нам не удалось обработать ваш запрос в данный момент. Повторите попытку позже.        IP-адресс: 10.10.226.27=====G Suite - Неправильный адрес электронной почты 	  Неправильный адрес электронной почты  Нам не уда";6
"4. Техническая поддержка (support@pnu.edu.ru)";СНИЛС – это личный страховой номер из 11 цифр;"Не могу внести Снилс         Отправлено из мобильной Почты Mail.ru      среда, 23 декабря 2020 г., 07:30 +0300 от support@pnu.edu.ru  <support@pnu.edu.ru>:  >Здравствуйте! Не забудьте прочесть письмо до конца!  >Настоящим мы подтверждаем, что получили Ваше сообщение.  >Мы обработаем Ваш запрос и свяжемся с Вами при первой возможности.  >Вашему запросу был присвоен номер 51340.  >!!!ВНИМАНИЕ!!!  >Для того чтобы специалисты как можно яснее восприняли ваш запрос и решили проблему, необходимо соблюсти несколько  важных правил :  >1 - Приложите ""скриншот экрана с проблемой"" в ответе на это письмо, если этого е";3
"4. Техническая поддержка (support@pnu.edu.ru)";"Спасибо.    С уважением, начальник отдела кадров ФГБОУ ВО ""ТОГУ""  Маилова Елена Викторовна  8 4212 73 40 04";"Коллеги, добрый день! Прошу разместить настоящий приказ с сопроводительным   текстом в личном кабинете в новостной строке:      Вниманию руководителей структурных подразделений!  Просим ознакомиться с  приказом от 18.05.2020 ?001/335общ. ""О введении   режима простоя"".  Приложение к приказу будет направлено непосредственно руководителю   структурного подразделения   на корпоративный адрес эл.почты.           С уважением, начальник отдела кадров ФГБОУ ВО ""ТОГУ""  Маилова Елена Викторовна  8 4212 73 40 04=====Коллеги, добрый день!    Прошу разместить прилагаемый документ на сайте уни";2
"4. Техническая поддержка (support@pnu.edu.ru)";Там вопрос к WiFi сети, которая в данный момент уже работает. В помещении стоит домашний роутер от D-Link, настроенный Андреем Клюевым. Это не наше оборудование и за его правильную работу я не поручусь. ;Здравствуйте! В аудитории 430л нет интернета с пятницы. Просьба срочно  придти наладить настройки!=====Здравствуйте!  В ауд. 430л (преподавательская) отсутствует интернет с 09.06.2023 г.  Просим устранить неполадки в кротчайшие сроки.          IP-адрес: 10.10.100.114;2
"4. Техническая поддержка (support@pnu.edu.ru)";У вас в удаленном сеансе на рабочем столе есть папка для сохранения  Сохраняйте документы и прочие файлы в эту папку  Скачайте файл и запустите его у себя на компьютере  Вы должны быть подключены к сети Вуза, откроется сетевая папка в которой будет папка в которую вы сохранили документы;Добрый день!  Как с удаленного рабочего стола скопировать файл на свой рабочий стол?  Работаю с АИС Нагрузка (выдает сообщение что у меня нет прав администратора).  Сформированное поручение экспортирую в excel для отправки по почте.)    Копирование необходимо для согласования с преподавателями т.к. не  у всех  есть доступ.     С уважением, Светлана Норбоева        IP-адресс: 85.15.112.238=====Мне необходимо  перенести файл с удаленного рабочего стола на мой стол, для дальнейшей работы с документом и его пересылке      IP-адресс: 37.29.88.63=====Прошу подсказать как перенести информаци;4
"4. Техническая поддержка (support@pnu.edu.ru)";У вас на момент регистрации в ЛКА ТОГУ на pnu.edu.ru существовали данные о анкете из Госуслуг, причина бага была в этом. Сейчас мы поправили - бага не должно возникать при регистрации, попробуйте зарегистрироваться еще https://pnu.edu.ru/ru/applicant/cabinet/register/    Напишите что получилось, не получилось. Лучше со скриншотами внутри Личного Кабинета Абитуриента на pnu.edu.ru если в него зайдете после подтверждения;Отправлено с iPhone=====[image: image.png];2
"4. Техническая поддержка (support@pnu.edu.ru)";Это связано с процессом перевода студентов в новые факультеты. В ближайшее время Ваша студенческая карточка снова будет активной.;"Доброе утро, это Слива Алина из ПОНБ-21. Сверху красным написано, что меня  отчислили, но все сессии у меня сданы.=====Здравствуйте, Гайдук Т.А. Ю(б)-11, попала по ошибке в список отчисления не  работает портал ТОГУ.=====Здравствуйте. Судя по всему я не первый кто вам написал по поводу этой  проблемы.  По причичне ""отчислен""(хотя я ещё в академе), в Портале заблокирован  аккаунт .  Прошу исправить=====Добрый день, я староста ПП(с)-91, и вся моя группа с недавнего времени столкнулась с такой проблемой: в разделе «портфолио» в личном кабинете портала ТОГУ мы все отмечены как «о";6
