"name";"answer";"questions";"rcounts"
 Техническая поддержка Библиотека;Добрый день, книги продлены на весенний семестр.;Здравствуйте, в связи с дистантом не могу сдать книги, продлите пожалуйста. книги в целости и не утеряны. спасибо до свидания. Баннова Ульяна Андреевна       IP-адресс: 164.138.88.178=====Здравствуйте. Мне ставят задолженность в библиотеке. Но моя группа находится на вынужденном дистанционном обучении. Я из другого города, региона. Книги сдать не представляется возможным Следующий семестр обещают сделать очным. При первой же возможности книги будут сданы в библиотеку.  Прошу Вас разобраться с этим вопросом и не ставить мне в задолженность несданные книги.  С уважени;5
 Техническая поддержка Библиотека;Здравствуйте, билет разблокирован.;Добрый день!   Мой читательский билет библиотеки ТОГУ был заблокирован после подписания обходного листа бакалавра. Сейчас я учусь в магистратуре. Читательский билет нужно разблокировать. Библиотека говорит что только вы можете это сделать через лотус.      IP-адресс: 87.225.66.200=====Добрый день! Мой читательский билет библиотеки ТОГУ был заблокирован после подписания обходного листа бакалавра. Сейчас я учусь в магистратуре. Читательский билет нужно разблокировать. Библиотека говорит что только вы можете это сделать через лотус.      IP-адресс: 80.83.234.62;2
"4. Техническая поддержка (support@pnu.edu.ru)";select * from student_card sc  join public.group g on g.id = sc.group_id  where sc.person_id = '77905';Здравствуйте.  Прошу техподдержки по студенту Ван Владимир Евгеньевич  РУ(аб)з-61  Цитирую часть письма:  При попытке зарегистрироваться на портале ТОГУ без кода, выдает такое  сообщение!  [image: image.png]  С уважением, замдиректора Кулик И.В.=====Здравствуйте!  Не могу распечатать логин и пароль от сайта, не высвечивается студент в  портале, хотя в Лотусе студент числится.    Скрин прилагаю    С уважением, секретарь ИЭУ, Е.К. Цнобиладзе;2
"4. Техническая поддержка (support@pnu.edu.ru)";"Браузерная версия для смартфона может работать некорректно, попробуйте использовать приложение gmail для смартфона (доступно для android (обычно установлено по умолчанию) и ios в app.store) или воспользоваться браузерной версией на компьютере. Перейти в браузерную версию почты на компьютере можно нажав на иконку почты в верхней части портала ТОГУ. Для добавления почты в приложении нужно нажать иконку профиля в правом верхнем углу, после чего ""Добавить аккаунт"", в появившемся окне набрать адрес электронной почты ""2021100584@pnu.edu.ru"" без кавычек. После чего вы будете перенаправлены на страницу входа в портал ТОГУ где необходимо ввести свои данные для входа. После выполнения этих действий аккаунт будет добавлен в приложение. Вы сможете отправлять почту и пользоваться поиском преподавателя по ФИО.";У меня не исправно работает почта   Не могу найти преподавателя по ФИО      IP-адресс: 80.83.234.223=====У меня не исправно работает почта   Не могу найти преподавателя по ФИО      IP-адресс: 80.83.239.91;2
"4. Техническая поддержка (support@pnu.edu.ru)";Были обновления операционной системы;"Добрый день. коллеги, возникла проблема с IBNNotes  [image: image.png]    [image: image.png]  Не получается открыть ЛогикаЕСМ ТОГУ (коммутатор, принятие решений.  поручения)    --   С уважением - Медведева Галина Геннадьевна,  проректор, ученый секретарь ученого совета Тихоокеанского государственного  университета  (4212) 768526-доб.1010=====Добрый день!    http://10.10.12.112/referent/br_switch.nsf    [image: image.png]    http://br.pnu.edu.ru/    [image: image.png]    Через лотус    [image: image.png]        --   С уважением,  Гусляков Виктор Владимирович,  Начальник отдела сопровождения административных процессов  ФГБОУ ВО ""Тихоокеанский государственны";4
"4. Техническая поддержка (support@pnu.edu.ru)";В базе нет сведений о том что Вы являетесь преподавателем;"На рабочем столе в личном кабинете исчезла закладка ""Расписание"". Не могу зайти в электронный журнал преподавателя и поставить оценки в экзаменационную ведомость.      IP-адрес: 10.10.100.114=====В личном кабинете пропала закладка ""Расписание (электронный журнал)"" в связи с этим не имею возможность проставить оценку обучающимся в экзаменационные ведомости!      IP-адрес: 10.10.100.114";2
"4. Техническая поддержка (support@pnu.edu.ru)";В вашем личном кабинете раздел будет доступен через 15 минут.;Здравствуйте! Мне недоступно заполнение табеля    [image: image.png]    --   С уважением, зав. кафедрой Правоведения, к.ю.н., доцент Хадыкина Елена=====Здравствуйте, подключите меня, ведущго документоведа деканата факультета  искуссв, рекламы и дизайна Вергель Надежду Федоровну к удаленному режиму.  Мн нужно сдавать табель, делать справки для студентов и создавать ведомости  текущей промежуточной аттестации. Спасибо=====Здравствуйте, к вам обращается зав. лабораторией кафедры БЭХ Стукова О.Ю. просьба восстановить доступ к заполнению до этого момента у меня был доступ к ;40
"4. Техническая поддержка (support@pnu.edu.ru)";в данный момент проводятся технические работы, повторите попытку через час;Добрый день, мне нужно подать заявление о подтверждении обучения в ТОГУ. Но у меня попросту нет кнопки подать, хотя все поля заполнены.       =====Здравствуйте, хотела оформить скидку обучение, а не получается. Не вылазит заявление.      IP-адресс: 213.221.12.250;2
"4. Техническая поддержка (support@pnu.edu.ru)";В настоящее время у Вас нет активных учетных карточек ППС. Возможно истечение срока контракта. Права восстановятся как только будет обработан приказ о приеме на работу, на должность ППС.;"Добрый день!   В личном кабинете пропала вкладка Журнал преподавателя!      IP-адресс: 5.8.206.135=====Здравствуйте. Подскажите, пожалуйста, почему перестал отображаться раздел ""Журнал преподавателя""!  Хотела проверить, все ли заполнено.      IP-адресс: 46.174.105.205=====Добрый день! Исчез журнал преподавателя, нет возможности закончить работу      IP-адресс: 62.249.146.123=====Добрый день! Я преподаватель кафедры правоведения ЮИ Радионова Ольга Александровна. В   В моем личном кабинете отсутствует журнал преподавателя. Прошу Вас оказать помощь в устранении данной проблемы.       IP-адресс: ";4
"4. Техническая поддержка (support@pnu.edu.ru)";"В оценках за сессию, есть 2 вкладки: Обучается и Переведен. Ваши оценки находятся во вкладке ""Обучается"".  Если оценок нет, пришлите скриншоты обеих вкладок.";Здравствуйте, у меня не отображается 3 семестр в разделе оценки за сессию  как это исправить?=====Здравствуйте, пропали в личном кабинете оценки за второй семестр первого курса.  Звонила в деканат предметы все стоят.  Ошибка в самом личном кабинете      IP-адресс: 185.3.180.246;2
"4. Техническая поддержка (support@pnu.edu.ru)";В скором времени все курсы будут добавлены;Здравствуйте, я студентка первого курса РСО(аб)оз-01. У меня на сайте эос в сводке по курсам высвечиваются только три дисциплины, хотя их больше. В деканате сказали обратиться к вам=====добрый день. у меня отображаются не все курсы в личном кабинете.   меня зовут Галкина Ксения, группа ЛПЕ ак-01.         IP-адресс: 85.26.241.125;2
"4. Техническая поддержка (support@pnu.edu.ru)";В скором времени курсы появятся в личном кабинете;Здравствуйте. В моём личном кабинете нет курсов. Подскажите, пожалуйста, как мне решить эту проблему? Спасибо.      IP-адресс: 37.29.88.193=====Здравствуйте. У меня возникли проблемы с доступом. У меня нет курсов по предметам. Подскажите, пожалуйста, как мне решить данную проблему? Спасибо.      IP-адресс: 37.29.88.193;2
"4. Техническая поддержка (support@pnu.edu.ru)";В скором времени ошибка отображения будет исправлена;"<https://www.avast.com/sig-email?utm_medium=email&utm_source=link&utm_campaign=sig-email&utm_content=webmail>  Без  вирусов. www.avast.ru  <https://www.avast.com/sig-email?utm_medium=email&utm_source=link&utm_campaign=sig-email&utm_content=webmail>  <#DAB4FAD8-2DD7-40BB-A1B8-4E2AA1F9FDF2>=====Здравствуйте.  У меня в личном кабинете сбились результаты данных по сессиям, показывает  информацию только за первый курс, хотя я уже на третьем. В тоже время в деканате сказали, что у них отображается моя ведомость до третьего курса.   С уважением Канасиро Диана       IP-адресс: 85.26.241.132=====Некорректно отображаются оценки за 3 и 4 семестр, отсутствуют оценки за 5 и 6 семестры. При этом в графе ""Оценки ";6
"4. Техническая поддержка (support@pnu.edu.ru)";в скором времени у вас появятся все курсы;Не подписан на курсы. Не имею возможности заниматься, во время дистанционного обучения      IP-адресс: 51.91.18.131=====Здравствуйте! В течение двух недель не могу решить проблему, которая возникла в личном кабинете.   У меня нет курсов ни по одному предмету.  Трошина Анастасия Максимовна, факультет: ФНДиДо, группа: ПОДЛ(аб)-01, тел.:89084636593  Проблему обнаружила 2 сентября в 8:30     --  Трошина Анастасия=====здравствуйте  у меня отображается только 1 курс      IP-адресс: 85.26.241.160;3
"4. Техническая поддержка (support@pnu.edu.ru)";В чем заключается ошибка? пришлите скриншот ошибки;В течение месяца не могу загрузить научные результаты студентов, полученные на конкурсах-выставках в соответствующий раздел. Они даже сюда не грузятся.      IP-адресс: 92.37.143.0=====Ошибка при отправлении резюме       IP-адресс: 80.83.234.203;2
"4. Техническая поддержка (support@pnu.edu.ru)";вам необходимо обратится в Деканат;Часть данных отображается с ошибкой, по причине неверно указанной группы (ПГСз-91). У меня группа ПГС(аб)зу-81. Неверные данные в истории приказов, в оценках за практику и др.       IP-адресс: 95.70.83.195=====Здравствуйте, меня зачислили в группу убп (аб) з а нужно было в убп (аб) зу собственно объяснили что ходить  на занятия с группой убп з и ждать перевода но вопрос в том как я потом буду сдавать зачёты в группе убп зу? Прошу Вас разобраться в данной проблеме. При поступлении прилагал документы об образовании и писал заявление.       IP-адресс: 80.83.234.122=====Здравствуйте подскажи;3
"4. Техническая поддержка (support@pnu.edu.ru)";Вам необходимо обратится в отдел кадров;Доброе утро!  С 1 февраля не могу зайти в личный кабинет.   Возможно это с тем, что у меня закончился трудовой договор 31 января 2021 г, но уже готовятся документы для заключения договора с 1 февраля 2021 г. по 31 июля 2021 г.  Если это мой недопуск именно с этим обстоятельством, то прошу предоставить мне допуск, так как я секретарь ГЭК 40.03.01 - 2 февраля 2021 проводится госэкзамен, мне необходимо иметь доступ к личному кабинету, чтобы размещать документы по ГЭК.      IP-адресс: 5.8.212.132=====Добрый день! В личном кабинете в списке сотрудников некорректно  отображается начало и оконча;2
"4. Техническая поддержка (support@pnu.edu.ru)";Вам необходимо повторно пройти процедуру регистрации(https://portal.khstu.ru/accounts/register/). Желательно не использовать пример хорошего пароля. А придумать аналогичный пароль для входа;Здравствуйте. Не могу зайти в свой личный кабинет на протяжении месяца. До этого целый год пользовалась, все было хорошо. Как можно решить эту проблему? Сайт постоянно пишет, что неправильный пароль.     Отправлено с моего телефона Huawei=====Доброго времени суток!  Я не имею доступ в электронный личный кабинет.  Обучаюсь на первом курсе магистратуры по направлению «08.04.01  Строительство», группа ВВ(ам) - 91 (2019)=====Не работает портальная почта ТОГУ      IP-адресс: 85.15.90.28=====Здравствуйте, не могу войти в свой корпоративный почтовый ящик. Нажимаю конверт (снимок 2) и получаю ;4
"4. Техническая поддержка (support@pnu.edu.ru)";Вам необходимо повторно пройти процедуру регистрации(https://portal.pnu.edu.ru/accounts/register/). Желательно не использовать пример хорошего пароля. А придумать аналогичный пароль для входа;"Здравствуйте, не могу войти на сайт  https://portal.pnu.edu.ru/accounts/login/?next=/    пишет неверный логин или пароль, сбрасываю пароль через электронную почту, меняю пароль но войти все ровно не могу      --  Ариф Якубов=====Здравствуйте  Прошу оказать техподдержку для входа на портал студенту ИЭУ К(аб) - 01  Чжэнь Синьвэй  Выводится окно с ошибкой (пересылаю сообщение)  С уважением, замдиректора ИЭУ Кулик И.В.    ---------- Forwarded message ---------  От: ♚ 少年与梦 <1913008599@qq.com>  Date: ср, 8 сент. 2021 г. в 22:27  Subject: 回复： Re:  To: 003187 <003187@pnu.edu.ru>              ------------------ 原始邮件 ------------------  *发件人:* ""003187"" <003187@pnu.edu.ru>;  *发送时间:* 2021年9";18
"4. Техническая поддержка (support@pnu.edu.ru)";Вам необходимо повторно пройти регистрацию  https://pnu.edu.ru/ru/applicant/cabinet/register/;--  Отправлено из Mail.ru для Android=====Здравствуйте. Не могу войти в личный кабинет абитуриента, перехожу по ссылке выдает вот такое. Пытаюсь запросить смену пароля выдает что учетной записи не найдено. И так все время.  --  Иван Еремеев=====Не могу зарегистрироваться (Номер телефона занят). Подавал заявление через  госуслуги. Каким образом войти в личный кабинет?;3
"4. Техническая поддержка (support@pnu.edu.ru)";вам необходимо пройти процедуру восстановления пароля  https://portal.khstu.ru/accounts/password_reset/  указать aleksandreremajt@gmail.com;Здравствуйте. Я студент тогу,  Смирнов Александр Иванович. Мне нужно  сбросить пороль от личного кабинета, пароль потерял, что делать?=====Извините, вы так и не ответили. Я не знаю не логин не пароль от своего  личного кабинета. Я даже не разу в него не заходил.  Я Смирнов Александр Иванович,  группа А(аб) 93.;2
"4. Техническая поддержка (support@pnu.edu.ru)";вам необходимо сменить пароль от личного кабинета  https://portal.pnu.edu.ru/accounts/password_change/;"личный кабинет не дает выход на корп.почту .P.S пишет ""Сервер не найден""      IP-адрес: 10.10.100.114=====Здравствуйте! А как активировать почту?Не могу понять. Хотя письмо о регистрации личного кабинета получила и регистрацию прошла. Заранее спасибо за ответ!    2022101856@pnu.edu.ru        С уважением,  Скоржевская Мария Николаевна  ___________________________________    моб. 8-909-841-34-63=====Здравствуйте! Не возможно зайти в почту. ауд.113-л,время 8-24 час,=====доброго времени суток! при заходе на почту через портал столкнулась с проблемой, при которой почта не открывается. портал выкидывает на страницу гугла с ";69
"4. Техническая поддержка (support@pnu.edu.ru)";вам необходимо сменить пароль от личного кабинета;Неправильный адрес электронной почты  Нам не удалось обработать ваш запрос в данный момент. Повторите попытку позже.    Почта 2020100808@pnu.edu,ru        IP-адресс: 213.221.12.111=====Кретов Алексей Владимирович  ТОГУ ИСИ  ПГС(аб)-01  +7(914)196-89-40    Проблема появилась примерно 3 сентября, во второй половине дня.    Чт, 8 окт. 2020 г. в 13:40, <support@pnu.edu.ru>:    > Здравствуйте! Не забудьте прочесть письмо до конца!  >  > Настоящим мы подтверждаем, что получили Ваше сообщение.  > Мы обработаем Ваш запрос и свяжемся с Вами при первой возможности.  > Вашему запросу был присвоен номер 48414.  >  > *!!!ВНИМАНИЕ!!!*  > Дл;26
