"name";"answer";"questions";"rcounts"
Департамент академической политики;Здравствуйте, переводы в ТОГУ осуществляются в периоды установленные локальными нормативными актами университета: август-сентябрь (до 10 сентября) и январь-февраль (до 10 февраля). В эти периоды времени вы можете подать документы лично (ауд. 245л.), по электронной почте  tsdk@pnu.edu.ru либо прислать почтой России     1. Заявление установленной формы (скачать на сайте ТОГУ)https://pnu.edu.ru/ru/students/perevod/   2. Копия аттестата   3. Копия паспорта (со страницей прописка)   4. Копия лицензии ВУЗа   5. Копия свидетельства об аккредитации (с приложениями, где указана ваша специальность)   6. Справка об обучении   Для иностранных граждан дополнительно:  1. Копия действующего паспорта.  2. Копия визы.  3. Копия действующей регистрации.  4. Копия миграционной карты.  5. Копия РВП (при наличии).   6. Копия вида на жительство (при наличии).   (Документы на иностранном языке должны бить оформлены нотариальным переводом)     Все копии документов, кроме копии паспорта должны быть заверены ВУЗом.   Факультет ТОГУ рассматривает документы 14 дней, после дает вам заключение аттестационной комиссии. Если условия перевода вам подходят начинаем обрабатывать документы, готовим для вас справки и тд.      Наличие вакантных бюджетных мест вы можете посмотреть здесь https://pnu.edu.ru/ru/students/budget-places/list/  ;      --Здравствуйте, обращаюсь к вам с вопросом о переводе из одной образовательной организации в другую по причине переезда. Я рассматриваю в качестве перевода ваш университет. Сейчас я учусь на 3 курсе УдГУ по направлению «История» (бакалавриат)  на бюджетном месте. . Я посмотрела образовательные программы ТОГУ и не нашла там похожей специальности, поэтому рассмотрела журналистику в качестве одного из вариантов. Сравнив образовательные программы, поняла, что начиная со 2 курса они сильно отличаются, и переводе сразу на 3 курс не может быть и речи. Я гото;2
Департамент академической политики;Здравствуйте, переводы в ТОГУ осуществляются в периоды установленные локальными нормативными актами университета: август-сентябрь и январь-февраль. В эти периоды времени вы можете подать документы лично (ауд. 245л.), по электронной почте  tsdk@pnu.edu.ru либо прислать почтой России     1. Заявление установленной формы (скачать на сайте ТОГУ)https://pnu.edu.ru/ru/students/perevod/   2. Копия аттестата   3. Копия паспорта (со страницей прописка)   4. Копия лицензии ВУЗа   5. Копия свидетельства об аккредитации (с приложениями, где указана ваша специальность)   6. Справка об обучении     Все копии документов, кроме копии паспорта должны быть заверены ВУЗом.   Факультет ТОГУ рассматривает документы 14 дней, после дает вам заключение аттестационной комиссии. Если условия перевода вам подходят начинаем обрабатывать документы, готовим для вас справки и тд.   ;добрый день, меня зовут Анна, я обучаюсь очно на бюджетной основе в АмГПГУ  факультет истории и юриспруденции. не нашла на вашем сайте информации по  вопросу о переводе к вам. я правильно понимаю, что перевестись к вам я могу  по итогам сессии. меня интересует переход именно на бюджетную основу. не  подскажете, как в таком случае вы работаете. надеюсь на дальнейшее  сотрудничество, при необходимости аттестат и дипломы могу выслать  электронно, на самом деле я достаточно неплохой человек в плане учебы и  активной гражданской позиции, но думаю несколько поздне;2
Департамент академической политики;Здравствуйте.  Выполнено.  С уважением,  ;"Добрый день. Верните, пожалуйста, учебно-методическую работу таблицы № 1       IP-адрес: 10.10.226.23=====Добрый день. Прошу вернуть доступ в программу как заведующего, так как я распределяю нагрузку по циклу Начертательная геометрия и машинная графика.      IP-адресс: 93.81.226.112=====Доброе утро. Прошу вас добавить профиль ""Строительство автомобильных дорог, мостов и тоннелей"" для перевода студентов групп С(б)-11, С(б)-12, С(б)-13 на профили.  Скрин прилагается      IP-адрес: 10.10.100.114=====Здравствуйте, студент группы ЛПВЯка(аб)-92,  Глеба А восстановился осенью на очное отделение ФВИ, в учеб";6
Департамент академической политики;Здравствуйте.  Группа создана.  С уважением,  ;Здравствуйте.  Создайте в Лотусе группу ПС(м)з-21, чтобы я смогла вывести студентов из  академа и перевести их в другую группу    --   С Уважением,  Елена Васильевна Ситникова,  декан ФПиСГТ  89241049964=====---------- Forwarded message ---------  От: Людмила Лазарева <001388@pnu.edu.ru>  Date: пн, 18 июл. 2022 г. в 14:01  Subject: добавить группу ГД(с)з-21  To: Ирина Шишкина <002177@pnu.edu.ru>      Здравствуйте. При создании представления в Lotus о выходе студентов из А/О  отсутствует группа ГД(с)з-21. Прошу добавит.Скриншот проблемы прилагаю.=====Здравствуйте.  Создайте в Лотусе группу ПОП(м)оз-01, чтобы я смогла вывести студентов и;3
Департамент академической политики;Здравствуйте.  Дисциплина в справочник добавлена.  С уважением,  ;"Добрый день! При  формировании представления на выход из а/отпуска  студентки Каримовой Ю.Н. в списке дисциплин нет "" Законодательство в БЖД""  Прошу добавить данную дисциплину.Скриншот прилагаю. Спасибо.  С уважением специалист 1 категории по УМР ИСИ Цой Е.А.=====Здравствуйте. Когда я делаю представление на вывод студента из АО , мне  надо прописать ему его задолженности, но  в выпадающем списке дисциплин нет  дисциплины *  Реставрация художественных изделий  ( *29.03.04 - О -  ТХОМ-19(3++) * ).*  Помогите пожалуйста.";2
Департамент академической политики;Здравствуйте.  Дисциплина добавлена в справочник.  С уважением,  ;"Здравствуйте!  При составлении индивидуального плана в Представлении в системе LOTUS в  разделе ""Дисциплина"" невозможно добавить дисциплину - нет нужного предмета  : ""История театра и кино"" (см.скриншот).  Пожалуйста, добавьте эту дисциплину.    С Уважением,  Богданова Дарья Викторовна,  Специалист по УМР, Деканат ФФПиМК,  ПиТОГУ (ПИ2-130)  тел. (4212) 30-23-79=====Здравствуйте. В учебном плане 38.05.01 О-ЭПОЭБ-ЭБ-22 3(++) есть вторая дисциплина ""Современная макроэкономическая политика"". Не могу найти ее в перечне дисциплин, чтобы прикрепить в УМКД на портале ТОГУ. Подскажите, что дел";2
Департамент академической политики;Здравствуйте.  Дисциплина добавлена.  Большая просьба - указывайте, пожалуйста, кафедру дисциплины.  ;Просьба добавить дисциплину: *Практикум по лингвострановедению изучаемого  иностранного  языка* в список дисциплин задолженностей для создания  представления с индивидуальным учебным планом.      --   С уважением, Кондакова О.П.=====Просьба добавить дисциплину: *Практикум устной и письменной речи в  подготовке переводчика* в список дисциплин задолженностей *для создания  представления* с индивидуальным учебным планом.      --   С уважением, Кондакова О.П.;2
Департамент академической политики;Здравствуйте.  Дисциплина добавлена.  С уважением,  ;"Для восстановления студенти необходимо добавить дисциплины в представление  по восстановлению. Добавьте в перечень дисциплин ""Методы диагностической и  коррекционно-развивающей работы с детьми с нарушениями речи""    --     *Специалист по УМР факультета начального, дошкольного и дефектологического  образования, Куташова Вероника Владимировна, 42-07-27*=====Здравствуйте. В представлении на вывод из академ отпуска в списке дисциплин  отсутствует дисциплина * Правовое обеспечение научно-исследовательских и  опытно-конструкторских работ*  Добавьте пожалуйста.    ";16
Департамент академической политики;Здравствуйте.  Дисциплины в справочник добавлены.  С уважением,  ;"Для создания представления на выход из академического отпуска студента ИЛМК  просьба добавить следующие дисциплины в базу Лотус:  - Стилистика первого иностранного языка  - История и культура стран второго изучаемого языка    --   С уважением, Кондакова О.П.=====Здравствуйте. В представлении на вывод из академ отпуска в списке дисциплин  отсутствуют дисциплины  *Основы метрологии  и сертификация художественных изделий;*  *Современные методы исследования металлов;*  *Проектирование литейной оснастки.*  Добавьте пожалуйста.=====Здравствуйте!     Делаю Представлен";3
Департамент академической политики;Здравствуйте.  Дисциплины добавлены.  С уважением,  ;Здравствуйте! Просьба добавить дисциплины *Учебная практика:  практикумы по* *пластическому  моделированию* и *Учебная практика: техника и технология ручной и печатной  графики *для составления представления  С Уважением,  Богданова Анастасия Викторовна,  Специалист по УМР, Деканат ФИРиД,  ПиТОГУ (ПИ2-239)  тел. (4212) 21-00-34=====---------- Forwarded message ---------  От: Ирина Сараханова <010056@pnu.edu.ru>  Date: пт, 22 сент. 2023 г. в 15:52  Subject: добавить в выбор дисциплины  To: УМУ поддержка ТОГУ <support_umu@pnu.edu.ru>      Здравствуйте, для формирования представления на перевод на студента,  добавьте, пожалуйст;13
Департамент академической политики;Здравствуйте.  Исправлено.  С уважением,  ;Здравствуйте! В Лотусе ФИРиД у группы ПОИД(б)-81 в личных делах форма  обучения обозначена ка заочная. Исправьте, пожалуйста на ОЧНАЯ=====Здравствуйте, у меня стоит пометка в эл. зачетной книжке, что я не найдена  в учебном плане, что это значит? и не показывает предметы на 4й семестр    <https://www.avast.com/sig-email?utm_medium=email&utm_source=link&utm_campaign=sig-email&utm_content=webmail>  Без  вирусов. www.avast.ru  <https://www.avast.com/sig-email?utm_medium=email&utm_source=link&utm_campaign=sig-email&utm_content=webmail>  <#DAB4FAD8-2DD7-40BB-A1B8-4E2AA1F9FDF2>=====С Уважением,    Руководитель ЦДК ТОГУ    Новикова Анна Михайловна    Тел.: 8(4212)76-85-24 (доб.1818)      ---------- Forwarded message ---------  От: ;61
Департамент академической политики;Здравствуйте.  Исправлено.  С уважением,;Здравствуйте, при печати диплома для группы ПОИО(б)з-61,  нет фамилии председателя, добавьте Платонова Н.М.. Спасибо.      IP-адресс: 10.0.62.53=====Здравствуйте. Внесите пожалуйста код специальности в учебную карточку ст.  Ж(б)з-91 Канатчиковой Т. В.=====Здравствуйте!  В тексте представления на восстановление Бабанина Евгения Анатольевна  ТЭФ / 1 курс / НТС(с) - 11 старый код направления. Прошу исправить.  Заранее спасибо!  [image: image.png]=====Здравствуйте!  В тексте представления на восстановление Чебан Михаил Анатольевич  ЗФ / 4 курс / СС(аб)з - 51 старый код направления. Прошу исправит;6
Департамент академической политики;Здравствуйте.  Исправлено.  С уважением.  ;"Добрый день    Удалить записи не соответствующие реальным итогам промежуточной аттестации    Зачет незачет 11.01.2019 Соловьев В. Л. Ведомость №*180960155*  Метрология. стандартизация и сертификация 144/72 Курсовая работа неудов.  10.01.2019 Соловьев В. Л. Ведомость №*180960156*  *(скан карточки прилагается)*    *С уважением*    *Попов Е.В.*=====Добрый вечер. Просьба удалить из ведомости 2019-2020 зима, дисциплина  ""Производственная практика: практика по получению проф.умений и опыта  проф.деятельности ( в том числе педагогическая практика), номер 19018070412  студентку Яковлеву Диану Романовну, ";3
Департамент академической политики;Информация передана декану заочного факультета;Здравствуйте. За первый семестр по физике я с опозданием сдал контрольную работу и лабораторную. Поэтому преподаватель не поставил зачет в первом семестре. Сейчас он принял и контрольную и лабораторную, но сказал, что надо обратиться в деканат, чтоб зачет за первый семестр проставили.  Подскажите, пожалуйста, как быть?  Или действительно у Вас зачет проставить можно?  С уважением, Усольцев Николай Владимирович, группа АС(аб)з-91      IP-адресс: 37.146.127.42=====Здравствуйте, я обучаюсь  группе ЗЧС(аб)зуд-91 (Пинчук Максим Владимирович) по двум предметам в электронной за;3
Департамент академической политики;Информация передана зав.аспирантурой Шабельниковой Е.А.;"Здравствуйте!    В разделе ""Общая информация"" поменяйте, пожалуйста, год начала подготовки  на 2016.    С уважением,  аспирант Елена Че=====Здравствуйте!    Переведите меня, пожалуйста, на 3 курс на портале ТОГУ в личном кабинете. В  приложении выписка из приказа с аспирантуры.    С уважением,  аспирант Елена Че=====Здравствуйте!    Где на сайте можно ознакомиться со стоимостью обучения в ТОГУ?      С уважением,  аспирант Елена Че";3
Департамент академической политики;Лишняя пара, пометку на удаление поставили;"Прошу открыть журнал посещения на преподавателя Фомина Андрея Анатольевича по дисциплинам: ""История Древнего мира"", ""История Средних веков"".        IP-адрес: 10.0.62.68=====Добрый день.Нужно с расписания убрать лекцию ""Физическая культура и спорт""  у преподавателя Хабаровой О.Л с датой 01,09.2022 по 05.01 2023 в  группе  НДК(б)-22.Спасибо";2
Департамент академической политики;Настя, я рассказывал и даже писал, как правильно вносить изменения в еженедельное расписание, так чтобы не терялись оценки.;Здравствуйте! В электронном журнале Хадыкиной Е.В. у группы УгП(аб)-91 по  дисциплине Теория государства и права пропали внесенные ранее темы лекций.  Такая же история у групп ГП и ГрП(аб)-91.  [image: image.png]    --   С уважением, зав. кафедрой Правоведения, к.ю.н., доцент Хадыкина Елена=====Так же еще пропали отметки о присутствии студентов этих групп на лекциях)))  (дисциплина Теория государства и права, группы ГП, ГрП, УгП(аб)-91)  [image: image.png]  --   С уважением, зав. кафедрой Правоведения, к.ю.н., доцент Хадыкина Елена;2
Департамент академической политики;Не достаточно данных для возможности выполнить задачу ;Здравствуйте!  Я пропустила заполнение электронной ведомости =====Здравствуйте!  Я пропустила заполнение электронной ведомости ;2
Департамент академической политики;Не могу удалить из ведомости. Пишет, что недостаточно прав для выполнения данной операции.;Добрый день!  Сессия Зима 2019-2020 Группа ПОФК(аб)з - 51  20018060121 производственная  практика студент Асеев отображается два раза, просьба удалить его из списка  где просто неявка без бегунка с оценкой. Заранее спасибо.  Делопроизводитель ФФК  Семенюк Наталья  (4212) 30-44-97=====Добрый день!  Студентка Бопп(Рощина) Валентина переводилась с очного на заочное и по  новому плану у них не было политологии. Просьба удалить студентку из  ведомости 17018060029 Сессия Зима 17-18 Политология. Это необходимо для  корректного отображения информации в дипломе. Заранее спасибо.    Делопроизвод;2
